{
  "version": 1,
  "author": "ldraw-astra construction reference wrapper",
  "assets": [
    "source.mpd"
  ],
  "sections": [
    {
      "name": "study-433ddd068200-placement.ldr",
      "description": "Millennium Falcon service-bay details",
      "anchors": {
        "source_origin": {
          "at": [
            0,
            0,
            0
          ]
        }
      },
      "steps": [
        [
          {
            "id": "reference",
            "ref": "study-433ddd068200-00-10179---subModel-43.ldr",
            "colour": 7,
            "at": [
              0,
              0,
              0
            ],
            "purpose": "Source construction; preserve internal geometry and review external interfaces"
          }
        ]
      ]
    }
  ]
}
