{
  "version": 1,
  "author": "ldraw-nova construction reference wrapper",
  "assets": [
    "source.mpd"
  ],
  "sections": [
    {
      "name": "study-b336cd6a5df1-placement.ldr",
      "description": "Police Station door column: a sideways stone column with clipped vines",
      "anchors": {
        "source_origin": {
          "at": [
            0,
            0,
            0
          ]
        }
      },
      "steps": [
        [
          {
            "id": "reference",
            "ref": "study-b336cd6a5df1-00-10278---doorcolumn2f.ldr",
            "colour": 7,
            "at": [
              0,
              0,
              0
            ],
            "purpose": "Source construction; preserve internal geometry and review external interfaces"
          }
        ]
      ]
    }
  ]
}
