{
  "version": 1,
  "author": "ldraw-astra reference example",
  "assets": [
    "source.mpd"
  ],
  "sections": [
    {
      "name": "example-submodel-1355a88e70f5307c9a5856a4.ldr",
      "description": "Ornamental globe lamp",
      "anchors": {
        "source_origin": {
          "at": [
            0,
            0,
            0
          ]
        }
      },
      "steps": [
        [
          {
            "id": "reference",
            "ref": "ref-1355a88e70f5307c-00-3316---Lamppost.ldr",
            "colour": 7,
            "at": [
              0,
              0,
              0
            ],
            "purpose": "An inverted transparent globe and a sideways foliage sprig give a street fitting a distinctive silhouette."
          }
        ]
      ]
    }
  ]
}
