{
  "version": 1,
  "author": "ldraw-nova construction reference wrapper",
  "assets": [
    "source.mpd"
  ],
  "sections": [
    {
      "name": "study-49720cda14a3-placement.ldr",
      "description": "Old Trafford glazed wall: built in its own frame, turned into the stand",
      "anchors": {
        "source_origin": {
          "at": [
            0,
            0,
            0
          ]
        }
      },
      "steps": [
        [
          {
            "id": "reference",
            "ref": "study-49720cda14a3-00-10272---stretford-end-step186-198.ldr",
            "colour": 7,
            "at": [
              0,
              0,
              0
            ],
            "purpose": "Source construction; preserve internal geometry and review external interfaces"
          }
        ]
      ]
    }
  ]
}
