{
  "version": 1,
  "author": "ldraw-nova mechanism reference wrapper",
  "assets": [
    "source.mpd"
  ],
  "sections": [
    {
      "name": "study-91bb09c2945d-placement.ldr",
      "description": "Four-speed driving-ring gearbox",
      "anchors": {
        "source_origin": {
          "at": [
            0,
            0,
            0
          ]
        }
      },
      "steps": [
        [
          {
            "id": "reference",
            "ref": "study-91bb09c2945d-00-atlas-four-speed-gearbox-00-42110---reargearbox.ldr",
            "colour": 7,
            "at": [
              0,
              0,
              0
            ],
            "purpose": "Source construction; preserve internal geometry and review external interfaces"
          }
        ]
      ]
    }
  ]
}
