{
  "version": 1,
  "author": "ldraw-nova construction reference wrapper",
  "assets": [
    "source.mpd"
  ],
  "sections": [
    {
      "name": "study-11deb4f1ed57-placement.ldr",
      "description": "Operator cabin technique",
      "anchors": {
        "source_origin": {
          "at": [
            0,
            0,
            0
          ]
        }
      },
      "steps": [
        [
          {
            "id": "reference",
            "ref": "study-11deb4f1ed57-00-42082---cabin.ldr",
            "colour": 7,
            "at": [
              0,
              0,
              0
            ],
            "purpose": "Source construction; preserve internal geometry and review external interfaces"
          }
        ]
      ]
    }
  ]
}
