{
  "version": 1,
  "author": "ldraw-astra reference example",
  "assets": [
    "source.mpd"
  ],
  "sections": [
    {
      "name": "example-submodel-3038a742034a696753eb880b.ldr",
      "description": "Mini construction truck cab",
      "anchors": {
        "source_origin": {
          "at": [
            0,
            0,
            0
          ]
        }
      },
      "steps": [
        [
          {
            "id": "reference",
            "ref": "ref-3038a742034a6967-00-4915---Mini-Construction---Cab.ldr",
            "colour": 7,
            "at": [
              0,
              0,
              0
            ],
            "purpose": "A narrow windscreen, shaped roof, grille and small wheel assemblies convey construction-vehicle character at a compact scale."
          }
        ]
      ]
    }
  ]
}
