{
  "version": 1,
  "author": "ldraw-astra reference example",
  "assets": [
    "source.mpd"
  ],
  "sections": [
    {
      "name": "example-submodel-6a39cb3c7dcadeb0dde97dab.ldr",
      "description": "Spacecraft wheel module",
      "anchors": {
        "source_origin": {
          "at": [
            0,
            0,
            0
          ]
        }
      },
      "steps": [
        [
          {
            "id": "reference",
            "ref": "ref-6a39cb3c7dcadeb0-00-5980---5980-4-a.ldr",
            "colour": 7,
            "at": [
              0,
              0,
              0
            ],
            "purpose": "Wheel-pin plates, a tall bracket and small exhaust and grille fittings give a compact wheeled module a mechanical identity."
          }
        ]
      ]
    }
  ]
}
