{
  "version": 1,
  "author": "ldraw-astra mechanism reference wrapper",
  "assets": [
    "source.mpd"
  ],
  "sections": [
    {
      "name": "study-3179e7a87c9e-placement.ldr",
      "description": "Differential in an axle frame",
      "anchors": {
        "source_origin": {
          "at": [
            0,
            0,
            0
          ]
        }
      },
      "steps": [
        [
          {
            "id": "mechanism",
            "ref": "study-3179e7a87c9e-00-42083---frontaxlediff.ldr",
            "colour": 7,
            "at": [
              0,
              0,
              0
            ],
            "purpose": "Reference mechanism; preserve its internal geometry and review external mounts"
          }
        ]
      ]
    }
  ]
}
