{
  "version": 1,
  "author": "ldraw-astra reference example",
  "assets": [
    "source.mpd"
  ],
  "sections": [
    {
      "name": "example-submodel-c5151f19163974e61079f916.ldr",
      "description": "Faceted research-ship bow",
      "anchors": {
        "source_origin": {
          "at": [
            0,
            0,
            0
          ]
        }
      },
      "steps": [
        [
          {
            "id": "reference",
            "ref": "ref-c5151f19163974e6-00-31045---Ship-front.ldr",
            "colour": 7,
            "at": [
              0,
              0,
              0
            ],
            "purpose": "Side-stud bricks and small slopes shape a compact ship bow in multiple directions without scaling any physical part."
          }
        ]
      ]
    }
  ]
}
