{
  "version": 1,
  "author": "ldraw-nova construction reference wrapper",
  "assets": [
    "source.mpd"
  ],
  "sections": [
    {
      "name": "study-8f53a18266f4-placement.ldr",
      "description": "Café Corner roof tower: parrot gargoyles and a hinged pyramid roof",
      "anchors": {
        "source_origin": {
          "at": [
            0,
            0,
            0
          ]
        }
      },
      "steps": [
        [
          {
            "id": "reference",
            "ref": "study-8f53a18266f4-00-10182---Second-floor---Roof-tower.ldr",
            "colour": 7,
            "at": [
              0,
              0,
              0
            ],
            "purpose": "Source construction; preserve internal geometry and review external interfaces"
          }
        ]
      ]
    }
  ]
}
